{
  "access_token": "uv0g7094uja3cvk1qm9nef1c5nc7wf",
  "refresh_token": "b4b4ha6ukjljkzf93ksqxsvorf0jpxfi4pl44lfzncihnheeww",
  "client_id": "ujnh9f5zxvxavxpolhkhhtojy27mta",
  "client_secret": "p6g4e2n82eaalcpb33jzs8ofe80523",
  "scopes": [
    "chat:edit",
    "chat:read"
  ],
  "expires_at": 1755125764852,
  "last_refresh_attempt": 1755110488852
}